{
  "schema_version": "cmf.run.v1",
  "run_id": "acs-version-b-framing-001",
  "project": {
    "id": "acs-site-b",
    "repo": "https://github.com/Pukujan/agent-custom-setup",
    "source_ref": "264117398e7754d7e91076481cd664b5e197c1d4",
    "visibility": "public",
    "product_subject": "Integrated Agent Custom Setup installation (ACS + PCM + OIO + CGM)"
  },
  "objective": "Plan a stronger human-centered Version B site while preserving the owner-favored Version A as an untouched baseline",
  "active_stage": "S0_intake",
  "gates": {
    "S0_intake": {
      "status": "review",
      "reason": "Pinned target repo and current task clarified; owner has not yet accepted B market brief"
    },
    "S1_truth": {
      "status": "draft",
      "reason": "Not yet reviewed for Version B"
    },
    "S2_human": {
      "status": "draft",
      "reason": "Not yet reviewed for Version B"
    },
    "S3_position": {
      "status": "draft",
      "reason": "Not yet reviewed for Version B"
    },
    "S4_story": {
      "status": "draft",
      "reason": "Not yet reviewed for Version B"
    },
    "S5_creative_handoff": {
      "status": "draft",
      "reason": "Not yet reviewed for Version B"
    },
    "S6_qa": {
      "status": "draft",
      "reason": "Not yet reviewed for Version B"
    }
  },
  "facts": [
    {
      "id": "F1",
      "statement": "ACS project contract assigns execution coordination to ACS, continuity to PCM, issue recording to OIO, and writing/visual direction to CGM.",
      "status": "observed",
      "source_refs": [
        "https://github.com/Pukujan/agent-custom-setup/blob/264117398e7754d7e91076481cd664b5e197c1d4/PROJECT.md"
      ],
      "source_revision": "264117398e7754d7e91076481cd664b5e197c1d4",
      "visibility": "public",
      "boundary": "Component ownership is not equivalent to validated adopter outcome.",
      "evidence_domain": "product_mechanism"
    },
    {
      "id": "F2",
      "statement": "Current public hotload spec describes full PCM, CGM, OIO and ACS runtime with PARTIAL on incomplete required installation.",
      "status": "observed",
      "source_refs": [
        "https://github.com/Pukujan/agent-custom-setup/blob/264117398e7754d7e91076481cd664b5e197c1d4/modules/coordination/multi-agent-hotload/v0.1.0/HOTLOAD.md",
        "https://github.com/Pukujan/agent-custom-setup/blob/264117398e7754d7e91076481cd664b5e197c1d4/modules/coordination/multi-agent-hotload/v0.1.0/SPEC.md"
      ],
      "source_revision": "264117398e7754d7e91076481cd664b5e197c1d4",
      "visibility": "public",
      "boundary": "Requires actual source check and safe run on a target before claiming a supported installation outcome.",
      "evidence_domain": "product_mechanism"
    },
    {
      "id": "F3",
      "statement": "Owner considers the current ACS site substantially better than early versions but not final; preserve it as Baseline A.",
      "status": "owner_direction",
      "source_refs": [
        "https://github.com/Pukujan/content-market-frame/blob/main/EPISTEMIC_STATE.md"
      ],
      "visibility": "sanitized",
      "boundary": "Owner qualitative assessment, not independent UX evidence or completed baseline capture.",
      "evidence_domain": "owner_direction"
    },
    {
      "id": "F4",
      "statement": "Owner wants the reusable framing router built and stabilized before initiating another site-generation experiment.",
      "status": "owner_direction",
      "source_refs": [
        "https://github.com/Pukujan/content-market-frame/blob/main/README.md"
      ],
      "visibility": "sanitized",
      "boundary": "Working direction in current conversation, not approval to generate/deploy Version B.",
      "evidence_domain": "owner_direction"
    },
    {
      "id": "F5",
      "statement": "Owner has identified the next output as an ACS market-facing Version B website, separate from current Baseline A.",
      "status": "owner_direction",
      "source_refs": [
        "plans/ACS_VERSION_B_MARKET_PAGE_FRAME.md"
      ],
      "visibility": "sanitized",
      "evidence_domain": "owner_direction",
      "boundary": "Authorizes framing work, not implicit story approval, ABA code generation or deployment."
    }
  ],
  "decisions": [
    {
      "id": "D1",
      "kind": "product_scope",
      "status": "proposed",
      "statement": "Market the integrated working surface, respecting the narrower ownership boundaries of each module.",
      "reason": "Avoid coordination-only or continuity-only collapse.",
      "fact_ids": [
        "F1",
        "F2"
      ]
    },
    {
      "id": "D2",
      "kind": "story",
      "status": "proposed",
      "statement": "Keep current live ACS website as untouched Baseline A until a recorded capture and owner-reviewed Version B brief exist.",
      "reason": "Make comparison fair and avoid repeating expensive rework.",
      "fact_ids": [
        "F3",
        "F4"
      ]
    },
    {
      "id": "D3",
      "kind": "audience",
      "status": "proposed",
      "statement": "Lead Version B with the individual long-project builder burdened by agent handoffs, ownership and reorientation; keep engineering team lead as a secondary candidate.",
      "reason": "Directly human-recognizable and spans installed ACS/PCM/OIO/CGM rather than one mechanism.",
      "fact_ids": [
        "F1",
        "F3",
        "F5"
      ]
    },
    {
      "id": "D4",
      "kind": "positioning",
      "status": "proposed",
      "statement": "Working B concept: Build with agents. Stop managing every handoff. Describe integrated repo-level working rules with explicit limitations and no ROI/time-saving statistics.",
      "reason": "Proposed differentiation from process-audit storytelling; not selected or independently tested.",
      "fact_ids": [
        "F1",
        "F2",
        "F5"
      ]
    },
    {
      "id": "D5",
      "kind": "cta",
      "status": "proposed",
      "statement": "Version B primary action is a no-write product walkthrough or a direct link to source-pinned setup instructions; exact behavior must be selected and verified before copy lock.",
      "reason": "A website preview must not imply local installer execution or mutate a visitor repo.",
      "fact_ids": [
        "F2",
        "F5"
      ]
    }
  ],
  "rejections": [
    {
      "id": "R1",
      "failure_class": "premature_generation",
      "why": "Do not generate a Version B website before the framing workflow and the creative direction have been reviewed.",
      "affected_decision_ids": [
        "D2"
      ],
      "evidence_ref": "https://github.com/Pukujan/content-market-frame/blob/main/CASE_STUDY_ACS.md"
    }
  ],
  "scenes": [],
  "claims": [],
  "handoff": {
    "summary": "Pinned ACS source supports market-facing Version B framing, but no story, CTA or production work is approved. Proposed human-first B concept and seven belief scenes are in plans/ACS_VERSION_B_MARKET_PAGE_FRAME.md. Baseline A site capture was unavailable to the reviewer; retain unchanged. Resolve lead audience/position and primary CTA with the owner before creative lock or ABA.",
    "fact_ids": [
      "F1",
      "F2",
      "F3",
      "F5"
    ],
    "decision_ids": [
      "D1",
      "D2",
      "D3",
      "D4",
      "D5"
    ],
    "open_questions": [
      "Does B lead with individual long-project builder / handoff burden, or a team operator's shared coordination?",
      "Will the primary CTA be a truthful read-only walkthrough or a source-linked setup guide?",
      "Can we freeze a reliable screenshot/copy/behavior capture of Baseline A before comparison?"
    ],
    "next_action": "Owner reviews concise B framing alternatives and CTA behavior; then author approved Experience Brief before isolated ABA build."
  },
  "history": [
    {
      "at": "2026-10-08",
      "action": "draft_created",
      "detail": "Version B framing record initialized as draft; no approval or experiment has occurred."
    },
    {
      "at": "2026-10-08",
      "action": "source_pinned_and_b_story_proposed",
      "detail": "Pinned ACS main SHA; added human-first B market-page candidate and distinct owner decisions. No gate accepted, no site generation or deployment."
    }
  ],
  "comparison": {
    "baseline_url": "https://acs.design-bakery.com/",
    "baseline_snapshot_ref": null,
    "candidate_ref": null,
    "baseline_verification": "not_captured",
    "note": "A is the live owner-favored reference, not a measured or permanently approved gold standard. Do not compare to an unpinned moving page."
  }
}
